{
  "$schema": "./registry.schema.json",
  "version": "1",
  "updated": "2026-05-14",
  "official": {
    "init": {
      "path": "spux-init.sh",
      "title": "SPUX Initializer",
      "description": "First-time SPUX setup — installs VSCode, Cline, and ~/.spux config.",
      "platform": ["macOS", "Linux"],
      "verified": true
    },
    "proxy": {
      "path": "scripts/proxy-setup.sh",
      "title": "Local Proxy Setup",
      "description": "Configures a local HTTP/HTTPS proxy for development.",
      "platform": ["macOS", "Linux"],
      "verified": true
    },
    "vscode-setup": {
      "path": "scripts/vscode-setup.sh",
      "title": "VSCode Power-User Setup",
      "description": "Installs a curated bundle of VSCode extensions for AI work.",
      "platform": ["macOS", "Linux", "Windows"],
      "verified": true
    },
    "llm-connect": {
      "path": "scripts/llm-connect.sh",
      "title": "LLM Provider Connector",
      "description": "Wires up API keys for Claude, OpenAI, Gemini in ~/.spux/config.",
      "platform": ["macOS", "Linux"],
      "verified": true
    },
    "cline-anthropic-proxy": {
      "path": "scripts/cline-anthropic-proxy.sh",
      "title": "Cline + Anthropic (SF Bedrock Proxy)",
      "description": "Installs VSCode + Cline and wires it to Claude via a local Salesforce Bedrock proxy on :9999.",
      "platform": ["macOS"],
      "verified": true,
      "doc": "scripts/cline-anthropic-proxy.md"
    }
  },
  "community": {}
}
